<!ELEMENT renderer (melheader|meltrailer|sep|attr|attrString|mel)*  >
<!ATTLIST renderer desc CDATA  #IMPLIED>

<!ELEMENT melheader EMPTY >
<!ATTLIST melheader s CDATA #REQUIRED>

<!ELEMENT meltrailer EMPTY >
<!ATTLIST meltrailer s CDATA #REQUIRED>

<!ELEMENT sep EMPTY >
<!ATTLIST sep desc CDATA  #IMPLIED>

<!ELEMENT attr EMPTY >
<!ATTLIST attr 
	n CDATA #REQUIRED 
	s CDATA #REQUIRED
	t CDATA #REQUIRED
	h CDATA #REQUIRED>

<!ELEMENT attrString EMPTY >
<!ATTLIST attrString 
	n CDATA #REQUIRED 
	s CDATA #REQUIRED
	t CDATA #REQUIRED
	h CDATA #REQUIRED>

<!ELEMENT mel EMPTY >
<!ATTLIST mel 
	n CDATA #REQUIRED 
	p CDATA #IMPLIED
	s CDATA #REQUIRED
	t CDATA #IMPLIED
	h CDATA #REQUIRED>
